Name,Description,Vendor,URL Slug,SKU,Price
"Blender","High-speed countertop blender for smoothies and shakes","KitchenTech","blender-speedmaster","SKU401","59.99"
"Bicycle Helmet","Adjustable helmet suitable for adults, safety-certified","RideSafe","helmet-adult","SKU402","24.49"
"Cotton Bath Towel","Soft and absorbent cotton bath towel in beige","HomeComforts","towel-bath-beige","SKU403","12.99"
"Wireless Mouse","Ergonomic wireless mouse with USB receiver","TechGear","mouse-wireless","SKU404","18.99"
"Garden Chair","Foldable garden chair with armrests, green","OutdoorLife","chair-garden-green","SKU405","19.49"
